[I 2025-12-02 07:21:30,195] Trial 139 pruned. 
[I 2025-12-02 07:21:41,822] Trial 140 pruned. 
[I 2025-12-02 07:22:41,458] Trial 141 pruned. 
[I 2025-12-02 07:23:46,230] Trial 142 finished with value: 0.3069833831654655 and parameters: {'num_layers': 1, 'hidden_0': 1536, 'dropout': 0.25412697466058504, 'activation': 'relu', 'use_batch_norm': True, 'lr': 1.2523033037067572e-05, 'weight_decay': 7.24836857253859e-05, 'batch_size': 128}. Best is trial 120 with value: 0.3007095613413387.
[I 2025-12-02 07:23:57,289] Trial 143 pruned. 
[I 2025-12-02 07:24:48,623] Trial 144 pruned. 
[I 2025-12-02 07:25:10,425] Trial 145 pruned. 
[I 2025-12-02 07:25:21,497] Trial 146 pruned. 
[I 2025-12-02 07:25:33,146] Trial 147 pruned. 
[I 2025-12-02 07:25:43,652] Trial 148 pruned. 
[I 2025-12-02 07:25:54,708] Trial 149 pruned. 
Best params (Low Loss): {'num_layers': 2, 'hidden_0': 1536, 'hidden_1': 1024, 'dropout': 0.2635956221658625, 'activation': 'relu', 'use_batch_norm': False, 'lr': 1.1452946929309732e-05, 'weight_decay': 6.097377673891129e-05, 'batch_size': 128}
Best Loss: 0.3007095613413387
Training final model...
Epoch 1 | Loss: 0.6886 | F1: 0.6936 | Avg Conf: 0.51 | LR: 1.15e-05
  -> Saved new best model (Lowest Loss)
Epoch 2 | Loss: 0.6631 | F1: 0.7528 | Avg Conf: 0.52 | LR: 1.15e-05
  -> Saved new best model (Lowest Loss)
Epoch 3 | Loss: 0.5917 | F1: 0.8688 | Avg Conf: 0.56 | LR: 1.15e-05
  -> Saved new best model (Lowest Loss)
Epoch 4 | Loss: 0.4927 | F1: 0.8796 | Avg Conf: 0.63 | LR: 1.15e-05
  -> Saved new best model (Lowest Loss)
Epoch 5 | Loss: 0.4053 | F1: 0.8799 | Avg Conf: 0.71 | LR: 1.15e-05
  -> Saved new best model (Lowest Loss)
Epoch 6 | Loss: 0.3479 | F1: 0.8807 | Avg Conf: 0.77 | LR: 1.15e-05
  -> Saved new best model (Lowest Loss)
Epoch 7 | Loss: 0.3142 | F1: 0.8881 | Avg Conf: 0.81 | LR: 1.15e-05
  -> Saved new best model (Lowest Loss)
Epoch 8 | Loss: 0.2932 | F1: 0.8867 | Avg Conf: 0.83 | LR: 1.15e-05
  -> Saved new best model (Lowest Loss)
Epoch 9 | Loss: 0.2822 | F1: 0.8904 | Avg Conf: 0.85 | LR: 1.15e-05
  -> Saved new best model (Lowest Loss)
Epoch 10 | Loss: 0.2758 | F1: 0.8923 | Avg Conf: 0.87 | LR: 1.15e-05
  -> Saved new best model (Lowest Loss)
Epoch 11 | Loss: 0.2747 | F1: 0.8881 | Avg Conf: 0.88 | LR: 1.15e-05
  -> Saved new best model (Lowest Loss)
Epoch 12 | Loss: 0.2760 | F1: 0.8868 | Avg Conf: 0.89 | LR: 1.15e-05
Epoch 13 | Loss: 0.2757 | F1: 0.8879 | Avg Conf: 0.90 | LR: 1.15e-05
Epoch 14 | Loss: 0.2803 | F1: 0.8877 | Avg Conf: 0.90 | LR: 1.15e-05
Epoch 15 | Loss: 0.2827 | F1: 0.8863 | Avg Conf: 0.91 | LR: 5.73e-06
Epoch 16 | Loss: 0.2850 | F1: 0.8860 | Avg Conf: 0.91 | LR: 5.73e-06
Epoch 17 | Loss: 0.2876 | F1: 0.8865 | Avg Conf: 0.91 | LR: 5.73e-06
Epoch 18 | Loss: 0.2886 | F1: 0.8857 | Avg Conf: 0.91 | LR: 5.73e-06
Epoch 19 | Loss: 0.2921 | F1: 0.8863 | Avg Conf: 0.91 | LR: 2.86e-06
Early stopping triggered.
Final Best Loss: 0.2747, F1 at that loss: 0.8881
    ~/proj/blackfox    main !6 ▓▒░                              ░▒▓ ✔  3h 32m 58s   07:28:11  